{
  "request_id": "GR10-Q2",
  "repository": "/Users/miryalasathvika/research/CIAO_integration/data_points/progetto_ing_software_gr10-main-English",
  "kept": [
    {
      "path": "src/main/java/Boundary/ActivityMonitoringGUI.java",
      "language": "java",
      "bytes": 30002,
      "reason": "source_extension"
    },
    {
      "path": "src/main/java/Boundary/HomePageGUI.java",
      "language": "java",
      "bytes": 7470,
      "reason": "source_extension"
    },
    {
      "path": "src/main/java/Boundary/InternalNoteGUI.java",
      "language": "java",
      "bytes": 12150,
      "reason": "source_extension"
    },
    {
      "path": "src/main/java/Boundary/ReceivedReportsGUI.java",
      "language": "java",
      "bytes": 35988,
      "reason": "source_extension"
    },
    {
      "path": "src/main/java/Boundary/ReportCreationGUI.java",
      "language": "java",
      "bytes": 36552,
      "reason": "source_extension"
    },
    {
      "path": "src/main/java/Boundary/ReportStatusUpdateGUI.java",
      "language": "java",
      "bytes": 17166,
      "reason": "source_extension"
    },
    {
      "path": "src/main/java/Boundary/SubmittedReportsGUI.java",
      "language": "java",
      "bytes": 25721,
      "reason": "source_extension"
    },
    {
      "path": "src/main/java/Boundary/UserDashboardGUI.java",
      "language": "java",
      "bytes": 22116,
      "reason": "source_extension"
    },
    {
      "path": "src/main/java/Boundary/UserLoginGUI.java",
      "language": "java",
      "bytes": 12442,
      "reason": "source_extension"
    },
    {
      "path": "src/main/java/Boundary/UserRegistrationGUI.java",
      "language": "java",
      "bytes": 17079,
      "reason": "source_extension"
    },
    {
      "path": "src/main/java/Control/ActivityMonitoringController.java",
      "language": "java",
      "bytes": 3724,
      "reason": "source_extension"
    },
    {
      "path": "src/main/java/Control/InternalNoteController.java",
      "language": "java",
      "bytes": 1679,
      "reason": "source_extension"
    },
    {
      "path": "src/main/java/Control/NotificationController.java",
      "language": "java",
      "bytes": 1392,
      "reason": "source_extension"
    },
    {
      "path": "src/main/java/Control/ReportCreationController.java",
      "language": "java",
      "bytes": 4811,
      "reason": "source_extension"
    },
    {
      "path": "src/main/java/Control/ReportDetailsController.java",
      "language": "java",
      "bytes": 2284,
      "reason": "source_extension"
    },
    {
      "path": "src/main/java/Control/ReportReviewController.java",
      "language": "java",
      "bytes": 1214,
      "reason": "source_extension"
    },
    {
      "path": "src/main/java/Control/ReportStatusUpdateController.java",
      "language": "java",
      "bytes": 2537,
      "reason": "source_extension"
    },
    {
      "path": "src/main/java/Control/SystemServicesController.java",
      "language": "java",
      "bytes": 5741,
      "reason": "source_extension"
    },
    {
      "path": "src/main/java/Control/UserLoginController.java",
      "language": "java",
      "bytes": 2106,
      "reason": "source_extension"
    },
    {
      "path": "src/main/java/Control/UserRegistrationController.java",
      "language": "java",
      "bytes": 4922,
      "reason": "source_extension"
    },
    {
      "path": "src/main/java/Database/JpaUtil.java",
      "language": "java",
      "bytes": 812,
      "reason": "source_extension"
    },
    {
      "path": "src/main/java/Database/PersistenceService.java",
      "language": "java",
      "bytes": 4497,
      "reason": "source_extension"
    },
    {
      "path": "src/main/java/Entity/Assigned.java",
      "language": "java",
      "bytes": 551,
      "reason": "source_extension"
    },
    {
      "path": "src/main/java/Entity/Citizen.java",
      "language": "java",
      "bytes": 626,
      "reason": "source_extension"
    },
    {
      "path": "src/main/java/Entity/Credentials.java",
      "language": "java",
      "bytes": 1033,
      "reason": "source_extension"
    },
    {
      "path": "src/main/java/Entity/InProgress.java",
      "language": "java",
      "bytes": 550,
      "reason": "source_extension"
    },
    {
      "path": "src/main/java/Entity/InternalNote.java",
      "language": "java",
      "bytes": 2706,
      "reason": "source_extension"
    },
    {
      "path": "src/main/java/Entity/Location.java",
      "language": "java",
      "bytes": 2178,
      "reason": "source_extension"
    },
    {
      "path": "src/main/java/Entity/MunicipalOperator.java",
      "language": "java",
      "bytes": 699,
      "reason": "source_extension"
    },
    {
      "path": "src/main/java/Entity/Notification.java",
      "language": "java",
      "bytes": 3918,
      "reason": "source_extension"
    },
    {
      "path": "src/main/java/Entity/Report.java",
      "language": "java",
      "bytes": 10340,
      "reason": "source_extension"
    },
    {
      "path": "src/main/java/Entity/ReportCategory.java",
      "language": "java",
      "bytes": 495,
      "reason": "source_extension"
    },
    {
      "path": "src/main/java/Entity/ReportService.java",
      "language": "java",
      "bytes": 26106,
      "reason": "source_extension"
    },
    {
      "path": "src/main/java/Entity/ReportStatus.java",
      "language": "java",
      "bytes": 274,
      "reason": "source_extension"
    },
    {
      "path": "src/main/java/Entity/Resolved.java",
      "language": "java",
      "bytes": 409,
      "reason": "source_extension"
    },
    {
      "path": "src/main/java/Entity/StatusUpdate.java",
      "language": "java",
      "bytes": 3327,
      "reason": "source_extension"
    },
    {
      "path": "src/main/java/Entity/Submitted.java",
      "language": "java",
      "bytes": 548,
      "reason": "source_extension"
    },
    {
      "path": "src/main/java/Entity/User.java",
      "language": "java",
      "bytes": 2886,
      "reason": "source_extension"
    },
    {
      "path": "src/main/java/Entity/UserService.java",
      "language": "java",
      "bytes": 6363,
      "reason": "source_extension"
    },
    {
      "path": "src/test/java/testingBlackBox/CreateNewReportBlackBoxTest.java",
      "language": "java",
      "bytes": 11089,
      "reason": "source_extension"
    },
    {
      "path": "src/test/java/testingBlackBox/MonitorActivityTrendsBlackBoxTest.java",
      "language": "java",
      "bytes": 8680,
      "reason": "source_extension"
    },
    {
      "path": "src/test/java/testingBlackBox/ReportStatusUpdateBlackBoxTest.java",
      "language": "java",
      "bytes": 5209,
      "reason": "source_extension"
    },
    {
      "path": "src/test/java/testingBlackBox/UserRegistrationBlackBoxTest.java",
      "language": "java",
      "bytes": 8626,
      "reason": "source_extension"
    },
    {
      "path": "src/test/java/testingWhiteBox/ReportStatusUpdateWhiteBoxTest.java",
      "language": "java",
      "bytes": 8359,
      "reason": "source_extension"
    }
  ],
  "dropped": [
    {
      "path": ".gitignore",
      "reason": "no_extension"
    },
    {
      "path": "CODE_TRANSLATION_MAP.csv",
      "reason": "non_code_extension"
    },
    {
      "path": "CODE_TRANSLATION_MAP.md",
      "reason": "non_code_extension"
    },
    {
      "path": "README.md",
      "reason": "non_code_extension"
    },
    {
      "path": "docs/documentazione-progetto/Documentazione.docx",
      "reason": "skip_directory"
    },
    {
      "path": "docs/documentazione-progetto/Documentazione.pdf",
      "reason": "skip_directory"
    },
    {
      "path": "docs/documentazione-progetto/Project_Documentation.docx",
      "reason": "skip_directory"
    },
    {
      "path": "docs/documentazione-progetto/Project_Documentation.pdf",
      "reason": "skip_directory"
    },
    {
      "path": "docs/visual-paradigm/IDENTIFIER_MAPPING.csv",
      "reason": "skip_directory"
    },
    {
      "path": "docs/visual-paradigm/IDENTIFIER_MAPPING.md",
      "reason": "skip_directory"
    },
    {
      "path": "docs/visual-paradigm/Software_Engineering_Project_GR10_English.vpp",
      "reason": "skip_directory"
    },
    {
      "path": "docs/visual-paradigm/TRANSLATION_AUDIT.json",
      "reason": "skip_directory"
    },
    {
      "path": "docs/visual-paradigm/TRANSLATION_AUDIT.md",
      "reason": "skip_directory"
    },
    {
      "path": "docs/visual-paradigm/validation-images/Activity Diagram - Monitor Activity Progress - Refined.png",
      "reason": "skip_directory"
    },
    {
      "path": "docs/visual-paradigm/validation-images/Class Diagram - BCED Pattern.png",
      "reason": "skip_directory"
    },
    {
      "path": "docs/visual-paradigm/validation-images/Class Diagram - Refined with Responsibilities.png",
      "reason": "skip_directory"
    },
    {
      "path": "docs/visual-paradigm/validation-images/Class Diagram.png",
      "reason": "skip_directory"
    },
    {
      "path": "docs/visual-paradigm/validation-images/Deployment Diagram.png",
      "reason": "skip_directory"
    },
    {
      "path": "docs/visual-paradigm/validation-images/Report - Life Cycle.png",
      "reason": "skip_directory"
    },
    {
      "path": "docs/visual-paradigm/validation-images/Requirements Analysis Diagram.png",
      "reason": "skip_directory"
    },
    {
      "path": "docs/visual-paradigm/validation-images/Send Notification to Citizen - BCED Pattern.png",
      "reason": "skip_directory"
    },
    {
      "path": "docs/visual-paradigm/validation-images/Sequence Diagram - Monitor Activity Progress - Refined.png",
      "reason": "skip_directory"
    },
    {
      "path": "docs/visual-paradigm/validation-images/Use Case Diagram.png",
      "reason": "skip_directory"
    },
    {
      "path": "pom.xml",
      "reason": "non_code_extension"
    },
    {